,edit_history_tweet_ids,id,text,lang
0,['1652005566623916034'],1652005566623916034,"sudan conflict threatens pepsi and coke due to shortage of key ingredient
the conflict in sudan has left international consumer goods makers racing to shore up supplies of gum arabic - critical to the food, drinks and cosmetics industry. coke pepsi",en
3,['1652004036755767314'],1652004036755767314,"pepsico pepsi i'll pass on all the sugar, no thanks.",en
4,['1652003275984519191'],1652003275984519191,"stopfundinghate purecremation skyuk jet2tweets goldenleavesuk moneysupermkt fireawaypizza belgicaweb chumsclothinguk homestoreint postcodelottery rolex pepsi truth hurts, doesn't it?! you are projecting your own hate and see everything thought it. you wouldn't know truth if it'd hit you on the head.stop winning.",en
5,['1652002021245960192'],1652002021245960192,pepsi what ever happened to pepsicafe? i was looking forward to it but it never came around. y'all to starry-eyed to stay focused or what? ;) xd,en
6,['1652001187145863168'],1652001187145863168,pepsi unveils new campaign with actress samantha ruth prabhu as brand ambassador brandnews pepsi samantharuthprabhu ,en
8,['1652000871587229717'],1652000871587229717,"pepsi brand ambassador....
just wanna promote pepsico in nigeria..
we love pepsico products
try bringing more of these products to 9ja
pepsi9ja 
get pepsi zero sugar mini cans + chestercheetah flamin' hot fritolayminis on shelves now!
getapepsicoproductnow ",en
11,['1651998018500165634'],1651998018500165634,lovemesome1980s freebyrd316 nicomartelle hemanismyhero stradlemonkey motudrawing mark_lapping sinjun45 captainbacon61 addictedhe the_tyebox hemanfan1 brooksidefilms tentaclause gillster37 therealwallbie aliciamariebody lizhobbs1974 smax140adams cimerians michaelodomart jfdm76 wheeljack83 deanetts seitayokokawa kevhulk73 battleramblog tylerslam dccomics mattel mastersofficial kimberlandart pepsi neca_toys hulkhogan konami metallica outbacksteakaus arcade_1up oreo pandaexpress pizzahut codyrhodes great pics 😊👍,en
12,['1651997828615483406'],1651997828615483406,"freebyrd316 nicomartelle hemanismyhero stradlemonkey motudrawing brokenbridgegxb mark_lapping sinjun45 captainbacon61 addictedhe the_tyebox hemanfan1 brooksidefilms tentaclause gillster37 therealwallbie aliciamariebody lizhobbs1974 smax140adams cimerians michaelodomart jfdm76 wheeljack83 deanetts seitayokokawa kevhulk73 battleramblog tylerslam dccomics mattel mastersofficial kimberlandart pepsi neca_toys hulkhogan konami metallica outbacksteakaus arcade_1up oreo pandaexpress pizzahut codyrhodes well, it looks like that i'm going to have to get another ""unlicensed nuclear accelerator"" and that's awesome.🤘👻🚫 protonpack whoyagonnacall 
ghostbusters iaintafraidofnoghost bustingmakesmefeelgood 

 ",en
15,['1651996964966346770'],1651996964966346770,"hey pepsi tell me.... how can both these nuitrition labels for mtn dew, be right? answer: they can't. how much of recommended adult intake of sugar again? pepsicanada

rdtwitter nuitionist cfia govcanhealth ",en
18,['1651995880424189958'],1651995880424189958,commanders emmanuelforbes7 pepsi best pick of the draft. special young man with a special talent! straight dog in the backfield! welcome emmanuelforbes7 httc,en
19,['1651994599341142016'],1651994599341142016,clearly my students at ⁦rfkcommunity⁩ doctor franklin perkins school know about my diet ⁦pepsi⁩ vice! they just stopped in with a friday sweet treat!! ,en
20,['1651993843041009666'],1651993843041009666,"amalqa_ cocacola_ksa pepsi obviously, creative advertising is not your thing.",en
23,['1651991892161077248'],1651991892161077248,"speaking with freddyroosevelt, amajor823, rillitamichelle, mamamianola, traphousepapi and _heyitstiff  ⁦redbull⁩ are you paying attention? kindly no more ⁦pepsi⁩ and ⁦revolttv⁩ it’s ok ⁦freddyroosevelt⁩ does this!",en
25,['1651991162390032397'],1651991162390032397,"despite the threat of a tiktok_us ban, usa advertising on tiktok grew 11% in march 2023 with top spenders including apple, pepsi, doordash  and amazon.

ads business growth money",en
26,['1651989293726937100'],1651989293726937100,"tonybirdlondon stopfundinghate purecremation skyuk jet2tweets goldenleavesuk moneysupermkt fireawaypizza belgicaweb chumsclothinguk homestoreint postcodelottery rolex pepsi pepsico_uk pepsimaxuk i will join you, i will miss pepsi max but i can't buy a company's product that sponsors that much hate.",en
27,['1651988754624651264'],1651988754624651264,"సమంత పెప్సీ యాడ్ పై విమర్శలు..! - samantha pepsi ad netizen reaction   khushi pepsi samantha samanthapepsi tollywood web telugu telugustop

",en
28,['1651988486105313301'],1651988486105313301,"yelp reviews can be extremely frustrating for business owners!

youtube: 
listen: 

podcast marketing marketingpodcast marketingtips
marketingstrategy businesssuccess businessreviews yelp pepsi ",en
31,['1651987633508167690'],1651987633508167690,"we're still in full swing but quick shout-out to cityofcincy rumpkenews votelizkeating cintrifuse team, kroger proctergamble fifththird madtreebrewing michelman cocacola cvgairport pepsi for outsourcing an extreme challenge to startups.  rethinkrecycling…  ",en
32,['1651985158738780160'],1651985158738780160,stopfundinghate purecremation skyuk jet2tweets goldenleavesuk moneysupermkt fireawaypizza belgicaweb chumsclothinguk homestoreint postcodelottery rolex pepsi will avoid these brands wherever possible until they show some decency.  dobetter,en
34,['1651983289635295234'],1651983289635295234,commanders emmanuelforbes7 pepsi you have no idea what you have gotten in this young man but you will. he is hail state strong.,en
35,['1651981985512824839'],1651981985512824839,commanders emmanuelforbes7 pepsi he’s a hillbilly let’s go,en
36,['1651981773121925122'],1651981773121925122,"pepsiindia duniya kheechegi neeche but you gotta rise up baby
pepsiindia just in love with pepsi❤‍🔥
pepsi pepsiriseupbaby pepsiindia pepsituterakarxsamantha ",en
38,['1651980848793546752'],1651980848793546752,motudrawing freebyrd316 nicomartelle hemanismyhero stradlemonkey brokenbridgegxb mark_lapping sinjun45 captainbacon61 addictedhe the_tyebox hemanfan1 brooksidefilms tentaclause gillster37 therealwallbie aliciamariebody lizhobbs1974 smax140adams cimerians michaelodomart jfdm76 wheeljack83 deanetts seitayokokawa kevhulk73 battleramblog tylerslam dccomics mattel mastersofficial kimberlandart pepsi neca_toys hulkhogan konami metallica outbacksteakaus arcade_1up oreo pandaexpress pizzahut codyrhodes you got it brother.👍😉,en
40,['1651980223875895296'],1651980223875895296,"lovemesome1980s freebyrd316 nicomartelle hemanismyhero stradlemonkey brokenbridgegxb mark_lapping sinjun45 captainbacon61 addictedhe the_tyebox hemanfan1 brooksidefilms tentaclause gillster37 therealwallbie aliciamariebody lizhobbs1974 smax140adams cimerians michaelodomart jfdm76 wheeljack83 deanetts seitayokokawa kevhulk73 battleramblog tylerslam dccomics mattel mastersofficial kimberlandart pepsi neca_toys hulkhogan konami metallica outbacksteakaus arcade_1up oreo pandaexpress pizzahut codyrhodes how come i never know this day is coming until it’s already here? ha ha! do me a favor; remind us a few days before, next year! 👍👍
happy masters of the universe day!!! ⚔️💪",en
41,['1651979946892435463'],1651979946892435463,amalqa_ cocacola_ksa pepsi it's an old advertisement. i don't think they do this kind of ads now,en
42,['1651979745788149760'],1651979745788149760,respiroofficial pepsico pepsi yes it does if your girl is so sweet 😂😂,en
44,['1651978087054348288'],1651978087054348288,"rt indiatoday: old taste, new bottle, campa cola is making a comeback. most of us weren’t around when it was a hit, so let’s go down the n…",en
45,['1651977458621480960'],1651977458621480960,sofi_giuseppe pepsico pepsi what's the difference?,en
46,['1651977223564324873'],1651977223564324873,"thedrhell pepsico pepsi the hell is diabet? also, is it sexually transmitted?",en
47,['1651976892080173056'],1651976892080173056,stopfundinghate purecremation skyuk jet2tweets goldenleavesuk moneysupermkt fireawaypizza belgicaweb chumsclothinguk homestoreint postcodelottery rolex pepsi your tweet seems at odds with your name.,en
48,['1651975912689135617'],1651975912689135617,jmdr22 pepsico pepsi i drank and coke and ate oreos and died 4 times,en
49,['1651975714537652225'],1651975714537652225,"bryceyourselves sskroughriders northernpikes pepsi no, young people",en
0,['1651975623001137152'],1651975623001137152,freebyrd316 nicomartelle hemanismyhero stradlemonkey motudrawing brokenbridgegxb mark_lapping sinjun45 captainbacon61 addictedhe the_tyebox hemanfan1 brooksidefilms tentaclause gillster37 therealwallbie aliciamariebody lizhobbs1974 smax140adams cimerians michaelodomart jfdm76 wheeljack83 deanetts seitayokokawa kevhulk73 battleramblog tylerslam dccomics mattel mastersofficial kimberlandart pepsi neca_toys hulkhogan konami metallica outbacksteakaus arcade_1up oreo pandaexpress pizzahut codyrhodes lol!😄 i love it.,en
2,['1651975199590318080'],1651975199590318080,tesla_is_trex pepsico pepsi so is this website but here we all are,en
3,['1651974852423688192'],1651974852423688192,freebyrd316 nicomartelle hemanismyhero stradlemonkey motudrawing brokenbridgegxb mark_lapping sinjun45 captainbacon61 addictedhe the_tyebox hemanfan1 brooksidefilms tentaclause gillster37 therealwallbie aliciamariebody lizhobbs1974 smax140adams cimerians michaelodomart jfdm76 wheeljack83 deanetts seitayokokawa kevhulk73 battleramblog tylerslam dccomics mattel mastersofficial kimberlandart pepsi neca_toys hulkhogan konami metallica outbacksteakaus arcade_1up oreo pandaexpress pizzahut codyrhodes happy motu day to all my motu loving brothers and sisters!🤘⚡️🗡💪 heman motu greatesttoysevermade greatestfranchiseintheuniverse ,en
4,['1651974785377914880'],1651974785377914880,"the perfect pick-me-up for any time of day! whether you're at work, at home, or on the go, pepsi has got you covered. pepsiwithsam",en
5,['1651974675189170176'],1651974675189170176,craving something sweet and satisfying? look no further than pepsi - the classic cooldrink that never goes out of style pepsiwithsam,en
6,['1651974554619875334'],1651974554619875334,"when the going gets tough, the tough grab a can of pepsi. whether you're in the middle of a workday or a workout
pepsiwithsam",en
8,['1651973688793747456'],1651973688793747456,"commanders emmanuelforbes7 pepsi you’ll be ok, just put more muscles and weight.  nfl is another level.",en
9,['1651973437462663168'],1651973437462663168,sadderwashfan commanders emmanuelforbes7 pepsi saying that they look alike,en
10,['1651973065864265733'],1651973065864265733,jzed87 sskroughriders northernpikes pepsi did they cancel?,en
11,['1651972821533220866'],1651972821533220866,stopfundinghate purecremation skyuk jet2tweets goldenleavesuk moneysupermkt fireawaypizza belgicaweb chumsclothinguk homestoreint postcodelottery rolex pepsi oh the irony of your name is truly hilarious …. you can’t just shut down any narrative you want just because you disagree with it  … love gbnews and watch it daily,en
12,['1651972538451230727'],1651972538451230727,"drromantic3 jiminxtiffanyandco ponniyanselvan2. starwarsjedisurvivor istandwithmychampions
donjazzy heisrema afpfactcheck cocacola pepsi pepsi_naija jazzysburger  out yungjeezus iniobong venomspittah's video! tiktok ",en
13,['1651972025848832001'],1651972025848832001,"rt evan_van_ives: have a pepsi day ✌️ 

📸 boho_boys 

wideangle pepsi nsfw gay twink blond retro vintage 70s 80s legs https://…",en
15,['1651970404829855745'],1651970404829855745,dwyatthupton will_jun1or like it! we all know who wins pepsi defensive rookie of the week game 1,en
16,['1651969652027711489'],1651969652027711489,bryceyourselves sskroughriders northernpikes pepsi they ain’t coming anyways,en
17,['1651969517160108033'],1651969517160108033,"check out my gig on fiverr: organically premium youtube video promotion using google ads  
arsenal jisoo chatgpt pepsi tiffany google
haaland palestine everton spotify defi chelsea",en
18,['1651969041030938627'],1651969041030938627,commanders emmanuelforbes7 pepsi welcome to washington young man. looking forward to your future with washington.,en
20,['1651967371035262979'],1651967371035262979,stoolgreenie bruh just like the executed my grandfather on dogs frfr no cap it be bussin out here skeet yeet yurt furt pepsi,en
21,['1651967290014056448'],1651967290014056448,rt rasikarajano1: samantharuthprabhuhot samantha samanthahot samantharuthprabhu𓃵 pepsixsamantha pepsi armpitslover armpitaddict a…,en
23,['1651966906125910016'],1651966906125910016,"pepsico pepsi i don't care what anyone says, this actually looks tasty",en
26,['1651965838264791041'],1651965838264791041,"rt suhas_dore__: happiest birthday sam😙💞
samanthaprabhu2 thenameisyash 

yash19 samantharuthprabhu yashboss
pepsi …",en
31,['1651962912423149568'],1651962912423149568,"pepsicocaresin sure pepsicocaresin i'm sharing my contact details through email, and for your convenience here is my mail id ramranjeet726gmail.com.

and for proof i'm attaching one video

pepsi pepsixsamantha pepsiriseupbaby ",en
33,['1651960726423244800'],1651960726423244800,lovemesome1980s nicomartelle hemanismyhero stradlemonkey motudrawing brokenbridgegxb mark_lapping sinjun45 captainbacon61 addictedhe the_tyebox hemanfan1 brooksidefilms tentaclause gillster37 therealwallbie aliciamariebody lizhobbs1974 smax140adams cimerians michaelodomart jfdm76 wheeljack83 deanetts seitayokokawa kevhulk73 battleramblog tylerslam dccomics mattel mastersofficial kimberlandart pepsi neca_toys hulkhogan konami metallica outbacksteakaus arcade_1up oreo pandaexpress pizzahut codyrhodes happy masters of the universe day ,en
34,['1651960550983892992'],1651960550983892992,lovemesome1980s nicomartelle hemanismyhero stradlemonkey motudrawing brokenbridgegxb mark_lapping sinjun45 captainbacon61 addictedhe the_tyebox hemanfan1 brooksidefilms tentaclause gillster37 therealwallbie aliciamariebody lizhobbs1974 smax140adams cimerians michaelodomart jfdm76 wheeljack83 deanetts seitayokokawa kevhulk73 battleramblog tylerslam dccomics mattel mastersofficial kimberlandart pepsi neca_toys hulkhogan konami metallica outbacksteakaus arcade_1up oreo pandaexpress pizzahut codyrhodes todays strip ,en
35,['1651960448823033858'],1651960448823033858,commanders emmanuelforbes7 pepsi welcome to washington!,en
37,['1651959868868182016'],1651959868868182016,5 stocks that outperform in recession➡️ walmart pandg johnsonandjohnson mcdonalds pepsi ,en
42,['1651959008939343874'],1651959008939343874,lokissidechic vnwalieoba pepsi they should make you ambassador at this point. 😂,en
44,['1651957779446349824'],1651957779446349824,commanders hailstatefb emmanuelforbes7 pepsi hail state.,en
47,['1651955812917555201'],1651955812917555201,britvic  as promised: proof of my switch due to the pepsi recipe change consequences ,en
49,['1651955683896737793'],1651955683896737793,"
i really appreciate samantha's advice.
it's awesome!
pepsiwithsam
pepsiriseupsamantha pepsixsamantha pepsituterakarxsamantha livekhabar24x7 pepsi📷 ",en
2,['1651954768968036352'],1651954768968036352,", this ad film is absolutely gorgeous. great job, pepsi and samantha!

pepsiriseupsamantha pepsituterakarxsamantha pepsiwithsam livekhabar24x7 pepsixsamantha pepsi📷 ",en
3,['1651953284499009536'],1651953284499009536,"rt lightbuzzmedia: the best way to rise up is to be bold, brave and you! take the leap and rise up baby with light buzz media.

pepsirise…",en
7,['1651952741009203200'],1651952741009203200,"this advertising is not good at all, if you want to degrade your competitor, then improve the price, quality and packaging, do not make such advertisements and lower the morale of the company
cocacola_ksa
pepsi ",en
9,['1651951978858127360'],1651951978858127360,"cold pepsi for this hot weather

pepsi ",en
11,['1651950790154797058'],1651950790154797058,curiosityrocks nike blockbuster nerf mtv pepsi pokemon jumpman23 shaq cocacola slimjim thesimpsons nickelodean not missing that point at all. we will have physicals back in june and globally next year. we really want people especially kids to have the same experience we did. collectibles just for them. i have been opening 90s packs and feel the nostalgia hit instantly. i hope you will too,en
16,['1651946960687976450'],1651946960687976450,"rt kevinlmcrae: we are getting ready to crushthetest  theh , and we need your help! searching for donations of mini orange crush sodas!…",en
17,['1651946880723562497'],1651946880723562497,johnlew18002259 commanders emmanuelforbes7 pepsi hater clown,en
19,['1651946778152022016'],1651946778152022016,rt carol36994460: have your executives ever watched gbnews a channel of hateforhirejournalists  hateforhirejournalists  a channel you su…,en
21,['1651946044152791046'],1651946044152791046,pepsico pepsi make pepsi just sign me as there ambassador nobody go happy reach me,en
24,['1651945580438999040'],1651945580438999040,fezenwafor tesla_is_trex pepsico pepsi a mineral 😌✨,en
25,['1651943662719488001'],1651943662719488001,"pepsi’s new ad strategy, they have casted samantha empowering women
ad 
samantharuthprabhu 

 pepsiwithsam pepsi pepsi_zero_sugar pepsiriseupbaby 
pepsiriseupbabyxsamantha 
pepsituterakarxsamantha 
pepsixsamantha",en
26,['1651943239161610240'],1651943239161610240,commanders emmanuelforbes7 pepsi let's  welcome to washington commanders,en
29,['1651942562280636417'],1651942562280636417,pepsico pepsi wait what? did you seriously pour pepsi in a shake?,en
30,['1651942492105850881'],1651942492105850881,"stopfundinghate purecremation skyuk jet2tweets goldenleavesuk moneysupermkt fireawaypizza belgicaweb chumsclothinguk homestoreint postcodelottery rolex pepsi the first part of the common sense crusade, should focus on hairstyling.",en
32,['1651942329509646336'],1651942329509646336,"rt suhas_dore__: happiest birthday sam😙💞
samanthaprabhu2 thenameisyash 

yash19 samantharuthprabhu yashboss
pepsi …",en
34,['1651942042249969664'],1651942042249969664,"would it be possible for you to not advertise on g.b. news , thanks 😀
purecremation skyuk jet2tweets
goldenleavesuk moneysupermkt
fireawaypizza belgicaweb
chumsclothinguk homestoreint
postcodelottery rolex selectspecs 
pepsi ",en
35,['1651941837173821440'],1651941837173821440,"the best way to rise up is to be bold, brave and you! take the leap and rise up baby with light buzz media.

pepsiriseupsamantha lightbuzzmedia digitalmarketing digitalmarketingagency socialmediaagency marketingagency pepsixsamantha pepsiriseupbabyxsamantha pepsi",en
36,['1651941450454794243'],1651941450454794243,rt rasikarajano1: samantharuthprabhuhot samantha samanthahot samantharuthprabhu𓃵 pepsixsamantha pepsi armpitslover armpitaddict a…,en
37,['1651941413616238592'],1651941413616238592,rt rasikarajano1: samantharuthprabhuhot samantha samanthahot samantharuthprabhu𓃵 pepsixsamantha pepsi armpitslover armpitaddict a…,en
38,['1651941338215243776'],1651941338215243776,rt rasikarajano1: samantharuthprabhuhot samantha samanthahot samantharuthprabhu𓃵 pepsixsamantha pepsi armpitslover armpitaddict a…,en
39,['1651941302408298500'],1651941302408298500,excited to start final round of cityofcincy recycling hackathon! kickoff with mayor aftabpureval councilwoman votelizkeating today's gonna be great! pepsi cokeccbcc ,en
40,['1651941243474280448'],1651941243474280448,rt rasikarajano1: samantharuthprabhuhot samantha samanthahot samantharuthprabhu𓃵 pepsixsamantha pepsi armpitslover armpitaddict a…,en
41,['1651941155729444866'],1651941155729444866,rt rasikarajano1: samantharuthprabhuhot samantha samanthahot samantharuthprabhu𓃵 pepsixsamantha pepsi armpitslover armpitaddict a…,en
42,['1651940468324745216'],1651940468324745216,commanders emmanuelforbes7 pepsi our roster is going to be stacked this year!,en
43,['1651940440634019841'],1651940440634019841,"rt vitalyvtennant: start offering pricing lifetime plans/memberships. in terms of  hardware to software, from hosting to plugins r…",en
44,['1651940299642486784'],1651940299642486784,"rt vitalyvtennant: start offering pricing lifetime plans/memberships. in terms of  hardware to software, from hosting to plugins r…",en
45,['1651940230943981568'],1651940230943981568,"rt vitalyvtennant: start offering pricing lifetime plans/memberships. in terms of  hardware to software, from hosting to plugins r…",en
46,['1651940033799094274'],1651940033799094274,"start offering pricing lifetime plans/memberships. in terms of  hardware to software, from hosting to plugins remember, wherever there is a mcdonalds, there is a burgerking, similarly, cocacola pepsi e.g. unstoppabledomains,  , web services",en
2,['1651933997054951425'],1651933997054951425,"rt suhas_dore__: happiest birthday sam😙💞
samanthaprabhu2 thenameisyash 

yash19 samantharuthprabhu yashboss
pepsi …",en
3,['1651930936219664386'],1651930936219664386,"life can be tough sometimes, but with the help of my favorite drink pepsi and the amazing music from sam, i know i can rise up and face any challenge. let's do this!pepsiwithsam
",en
5,['1651930724273111040'],1651930724273111040,"take a break from your busy day and treat yourself to the refreshing taste of pepsi. your taste buds will thank you pepsiwithsam
",en
6,['1651930681411518466'],1651930681411518466,"take a break from your busy day and treat yourself to the refreshing taste of pepsi. your taste buds will thank you pepsiwithsam
",en
7,['1651930637161627651'],1651930637161627651,"if there's one thing that can always quench my thirst, it's a cold can of pepsi. what's your go-to drink
pepsiwithsam
",en
8,['1651930593356050432'],1651930593356050432,we're about to kick off one of the nation's most ambitious recycling hacks featuring 10 startup finalists pitching cityofcincy kroger proctergamble fifththird pepsi cocacola rumpkenews madtreebrewing.  mayor aftabpureval kicks us off at 9 am est. come on down! ,en
9,['1651930586175660034'],1651930586175660034,"if there's one thing that can always quench my thirst, it's a cold can of pepsi. what's your go-to drink
pepsiwithsam
",en
10,['1651930475458330624'],1651930475458330624,pepsi put your recipe back!!! the new ingredients are awful!!! freedom for sugar!!,en
11,['1651930194716901379'],1651930194716901379,have your executives ever watched gbnews a channel of hateforhirejournalists  hateforhirejournalists  a channel you support. bye pepsi ,en
13,['1651928981761843205'],1651928981761843205,pepsico pepsi secure and sure betting tips from scott_bookies can't lose in betting again.boooooooooooom💥💥💥 ,en
15,['1651928325550481408'],1651928325550481408,mjjconspiracy pepsi sony jacksons good morning. i'll slide in your dms so we can chat about it. 😄,en
16,['1651928246940835844'],1651928246940835844,"purecremation
skyuk
jet2tweets 
moneysupermkt
fireawaypizza
belgicaweb
chumsclothinguk
homestoreint
postcodelottery
rolex
 selectspecs &amp; 
pepsi

why do you support the hate, transphobia, racism, homophobia, and anti-democracy of gb news?

stopfundinghate ",en
19,['1651927048296751104'],1651927048296751104,"hey pepsi it's april 28, 2023 at 02:31pm and i still don't have a pepsi holiday spice in my hands.",en
20,['1651926669517811712'],1651926669517811712,"🏴‍☠️ hi pepsi pepsico_uk pepsimaxuk 
i drink a lot of diet pepsi. a lot! 
probably too much.
but seeing you fund a tv channel which broadcasts far right bigotry and conspiracy theories is worrying.
i'm gay. i can't drink your product when support… ",en
21,['1651926306425061377'],1651926306425061377,"old taste, new bottle, campa cola is making a comeback. most of us weren’t around when it was a hit, so let’s go down the nostalgia road for those who drank campa and those who have no idea about it. 

newsmo campacola pepsi | jessica_goel ",en
24,['1651924748564062213'],1651924748564062213,commanders emmanuelforbes7 pepsi fromstatetosundays hailstate,en
27,['1651923448082432002'],1651923448082432002,stopfundinghate purecremation skyuk jet2tweets goldenleavesuk moneysupermkt fireawaypizza belgicaweb chumsclothinguk homestoreint postcodelottery rolex pepsi postcodelottery can we hear from you on this? i’d like to understand the why before i cancel my direct debit.,en
28,['1651923430164267009'],1651923430164267009,"day 34 of asking pepsico to bring sobe back to florida
                       
                    bringsobeback

                             pepsi ",en
29,['1651923044275740673'],1651923044275740673,"bossboy281 pepsi hi there, thank you for reaching out! we apologize this is not currently available in your area. we hope to see it here in the future.",en
34,['1651921164695109633'],1651921164695109633,"
there is no data attached for legal purpose recipients if this method was created for pablo or pepsi",en
35,['1651921093035270145'],1651921093035270145,"stopfundinghate purecremation skyuk jet2tweets goldenleavesuk moneysupermkt fireawaypizza belgicaweb chumsclothinguk homestoreint postcodelottery rolex pepsi rolex!  i'm cancelling my order forthwith 😉, how much is an ad break on gb news? the above must be losing more in product boycotting then profit.",en
36,['1651921015532933120'],1651921015532933120,"just bought a bottle of pepsi, and it was absolutely revolting. look in to it, and they have changed the recipe.
that's me done with one of my favourite drinks, never getting this rubbish again.
thanks pepsi",en
42,['1651919549166505984'],1651919549166505984,"hey pepsi it's april 28, 2023 at 02:01pm and i still don't have a pepsi holiday spice in my hands.",en
